[
  {
    "sep_version": "0.1.0",
    "item_id": "11111111-1111-1111-1111-111111111111",
    "source": {
      "platform": "youtube",
      "origin_url": "https://www.youtube.com/watch?v=abc123",
      "origin_id": "abc123",
      "content_type": "video",
      "duration_seconds": 623
    },
    "meta": {
      "title": "10-Minute Morning Workout — No Equipment",
      "creator": "FitLife Daily",
      "published": "2026-01-15T08:00:00Z",
      "original_tags": ["workout", "morning routine", "fitness"],
      "language": "en",
      "thumbnail_url": "https://i.ytimg.com/vi/abc123/hqdefault.jpg"
    },
    "enrichment": {
      "schema_version": "0.1.0",
      "enriched_at": "2026-02-28T10:00:00Z",
      "categories": [
        { "id": "fitness", "confidence": 0.95 },
        { "id": "motivation", "confidence": 0.40 }
      ],
      "emotional_tone": {
        "primary": "energized",
        "secondary": "inspired",
        "rage_bait": false,
        "humiliation": false,
        "shock_content": false,
        "inflammatory": false,
        "sexually_explicit": false,
        "violence": false
      },
      "energy_level": 0.85,
      "cognitive_load": 0.20,
      "motivation_score": 0.75,
      "humor_score": 0.15,
      "skill_transfer_score": 0.60,
      "production_quality": 0.80,
      "session_fit": {
        "good_opener": true,
        "good_builder": false,
        "good_peak": true,
        "good_closer": false
      }
    },
    "provider": {
      "id": "good-vibes-main",
      "guardrail_pass": true,
      "guardrail_version": "0.1.0"
    }
  },
  {
    "sep_version": "0.1.0",
    "item_id": "22222222-2222-2222-2222-222222222222",
    "source": {
      "platform": "youtube",
      "origin_url": "https://www.youtube.com/watch?v=xyz789",
      "origin_id": "xyz789",
      "content_type": "video",
      "duration_seconds": 892
    },
    "meta": {
      "title": "Marcus Aurelius — The Stoic Emperor's Daily Practice",
      "creator": "Philosophy Hub",
      "published": "2026-02-01T12:00:00Z",
      "original_tags": ["stoicism", "marcus aurelius", "philosophy"],
      "language": "en",
      "thumbnail_url": "https://i.ytimg.com/vi/xyz789/hqdefault.jpg"
    },
    "enrichment": {
      "schema_version": "0.1.0",
      "enriched_at": "2026-02-28T10:00:00Z",
      "categories": [
        { "id": "stoicism", "confidence": 0.92 },
        { "id": "motivation", "confidence": 0.55 }
      ],
      "emotional_tone": {
        "primary": "reflective",
        "secondary": "calm",
        "rage_bait": false,
        "humiliation": false,
        "shock_content": false,
        "inflammatory": false,
        "sexually_explicit": false,
        "violence": false
      },
      "energy_level": 0.35,
      "cognitive_load": 0.65,
      "motivation_score": 0.60,
      "humor_score": 0.05,
      "skill_transfer_score": 0.70,
      "production_quality": 0.75,
      "session_fit": {
        "good_opener": false,
        "good_builder": true,
        "good_peak": false,
        "good_closer": true
      }
    },
    "provider": {
      "id": "good-vibes-main",
      "guardrail_pass": true,
      "guardrail_version": "0.1.0"
    }
  },
  {
    "sep_version": "0.1.0",
    "item_id": "33333333-3333-3333-3333-333333333333",
    "source": {
      "platform": "youtube",
      "origin_url": "https://www.youtube.com/watch?v=jkl345",
      "origin_id": "jkl345",
      "content_type": "video",
      "duration_seconds": 495
    },
    "meta": {
      "title": "Best Stand-Up Comedy Clips 2026",
      "creator": "Comedy Central Clips",
      "published": "2026-02-10T16:00:00Z",
      "original_tags": ["comedy", "stand up", "funny"],
      "language": "en",
      "thumbnail_url": "https://i.ytimg.com/vi/jkl345/hqdefault.jpg"
    },
    "enrichment": {
      "schema_version": "0.1.0",
      "enriched_at": "2026-02-28T10:00:00Z",
      "categories": [
        { "id": "humor", "confidence": 0.98 }
      ],
      "emotional_tone": {
        "primary": "amused",
        "secondary": "energized",
        "rage_bait": false,
        "humiliation": false,
        "shock_content": false,
        "inflammatory": false,
        "sexually_explicit": false,
        "violence": false
      },
      "energy_level": 0.70,
      "cognitive_load": 0.15,
      "motivation_score": 0.10,
      "humor_score": 0.95,
      "skill_transfer_score": 0.05,
      "production_quality": 0.85,
      "session_fit": {
        "good_opener": true,
        "good_builder": false,
        "good_peak": false,
        "good_closer": true
      }
    },
    "provider": {
      "id": "good-vibes-main",
      "guardrail_pass": true,
      "guardrail_version": "0.1.0"
    }
  },
  {
    "sep_version": "0.1.0",
    "item_id": "44444444-4444-4444-4444-444444444444",
    "source": {
      "platform": "youtube",
      "origin_url": "https://www.youtube.com/watch?v=pqr901",
      "origin_id": "pqr901",
      "content_type": "video",
      "duration_seconds": 1122
    },
    "meta": {
      "title": "Build a Cutting Board from Scrap Wood",
      "creator": "Shaping Bay",
      "published": "2026-01-20T14:00:00Z",
      "original_tags": ["woodworking", "cutting board", "diy"],
      "language": "en",
      "thumbnail_url": "https://i.ytimg.com/vi/pqr901/hqdefault.jpg"
    },
    "enrichment": {
      "schema_version": "0.1.0",
      "enriched_at": "2026-02-28T10:00:00Z",
      "categories": [
        { "id": "craft", "confidence": 0.90 },
        { "id": "relaxation", "confidence": 0.45 }
      ],
      "emotional_tone": {
        "primary": "calm",
        "secondary": "focused",
        "rage_bait": false,
        "humiliation": false,
        "shock_content": false,
        "inflammatory": false,
        "sexually_explicit": false,
        "violence": false
      },
      "energy_level": 0.30,
      "cognitive_load": 0.45,
      "motivation_score": 0.25,
      "humor_score": 0.10,
      "skill_transfer_score": 0.80,
      "production_quality": 0.90,
      "session_fit": {
        "good_opener": false,
        "good_builder": true,
        "good_peak": false,
        "good_closer": true
      }
    },
    "provider": {
      "id": "good-vibes-main",
      "guardrail_pass": true,
      "guardrail_version": "0.1.0"
    }
  },
  {
    "sep_version": "0.1.0",
    "item_id": "55555555-5555-5555-5555-555555555555",
    "source": {
      "platform": "youtube",
      "origin_url": "https://www.youtube.com/watch?v=mno456",
      "origin_id": "mno456",
      "content_type": "video",
      "duration_seconds": 300
    },
    "meta": {
      "title": "Get Up and GRIND — Motivation Compilation",
      "creator": "MotivateMe",
      "published": "2026-02-15T06:00:00Z",
      "original_tags": ["motivation", "grind", "hustle"],
      "language": "en",
      "thumbnail_url": "https://i.ytimg.com/vi/mno456/hqdefault.jpg"
    },
    "enrichment": {
      "schema_version": "0.1.0",
      "enriched_at": "2026-02-28T10:00:00Z",
      "categories": [
        { "id": "motivation", "confidence": 0.93 },
        { "id": "fitness", "confidence": 0.30 }
      ],
      "emotional_tone": {
        "primary": "inspired",
        "secondary": "energized",
        "rage_bait": false,
        "humiliation": false,
        "shock_content": false,
        "inflammatory": false,
        "sexually_explicit": false,
        "violence": false
      },
      "energy_level": 0.90,
      "cognitive_load": 0.10,
      "motivation_score": 0.95,
      "humor_score": 0.05,
      "skill_transfer_score": 0.10,
      "production_quality": 0.70,
      "session_fit": {
        "good_opener": true,
        "good_builder": false,
        "good_peak": true,
        "good_closer": false
      }
    },
    "provider": {
      "id": "good-vibes-main",
      "guardrail_pass": true,
      "guardrail_version": "0.1.0"
    }
  },
  {
    "sep_version": "0.1.0",
    "item_id": "66666666-6666-6666-6666-666666666666",
    "source": {
      "platform": "youtube",
      "origin_url": "https://www.youtube.com/watch?v=rage01",
      "origin_id": "rage01",
      "content_type": "video",
      "duration_seconds": 400
    },
    "meta": {
      "title": "THEY DON'T WANT YOU TO KNOW THIS",
      "creator": "Rage Machine",
      "published": "2026-02-20T18:00:00Z",
      "original_tags": ["outrage", "politics", "conspiracy"],
      "language": "en",
      "thumbnail_url": "https://i.ytimg.com/vi/rage01/hqdefault.jpg"
    },
    "enrichment": {
      "schema_version": "0.1.0",
      "enriched_at": "2026-02-28T10:00:00Z",
      "categories": [
        { "id": "motivation", "confidence": 0.20 }
      ],
      "emotional_tone": {
        "primary": "energized",
        "secondary": null,
        "rage_bait": true,
        "humiliation": false,
        "shock_content": false,
        "inflammatory": true,
        "sexually_explicit": false,
        "violence": false
      },
      "energy_level": 0.95,
      "cognitive_load": 0.30,
      "motivation_score": 0.20,
      "humor_score": 0.0,
      "skill_transfer_score": 0.0,
      "production_quality": 0.40,
      "session_fit": {
        "good_opener": false,
        "good_builder": false,
        "good_peak": false,
        "good_closer": false
      }
    },
    "provider": {
      "id": "good-vibes-main",
      "guardrail_pass": true,
      "guardrail_version": "0.1.0"
    }
  },
  {
    "sep_version": "0.1.0",
    "item_id": "77777777-7777-7777-7777-777777777777",
    "source": {
      "platform": "youtube",
      "origin_url": "https://www.youtube.com/watch?v=music01",
      "origin_id": "music01",
      "content_type": "music",
      "duration_seconds": 210
    },
    "meta": {
      "title": "Lo-Fi Beats for Studying",
      "creator": "ChillBeats",
      "published": "2026-01-05T10:00:00Z",
      "original_tags": ["lo-fi", "study", "chill"],
      "language": "en",
      "thumbnail_url": "https://i.ytimg.com/vi/music01/hqdefault.jpg"
    },
    "enrichment": {
      "schema_version": "0.1.0",